{
  "bootstrap_resamples": 2000,
  "bootstrap_seed": 20261015,
  "note": "Harness counter. Each call is a LAMMPS lj/cut force evaluation.",
  "par_factor": 2,
  "problem": "globalopt/lj38",
  "runs": [
    {
      "algorithm": "GASP",
      "cap": 16000801,
      "code": "gasp",
      "code_version": "0.1",
      "commit": "0c8d993c82e0e1c69a05b3c34bbb2fcbbdbb7f07",
      "entry": "gasp-0c8d993c-lj38",
      "metrics": {
        "bootstrap_resamples": 2000,
        "bootstrap_seed": 20261015,
        "cap": 16000801,
        "includes_failures": true,
        "iqr": 0.0,
        "iqr_high": 0.0,
        "iqr_low": 0.0,
        "mean": 29412374.30612245,
        "median": 32001602.0,
        "median_high": 32001602.0,
        "median_low": 32001602.0,
        "n": 49,
        "n_cap": 0,
        "n_crash": 0,
        "n_divergence": 0,
        "n_wrong_stationary": 45,
        "nfailed": 45,
        "par2_mean": 29412374.30612245,
        "par_applied": true,
        "par_factor": 2,
        "q25": 32001602.0,
        "q75": 32001602.0,
        "scoring": "par2-wilson-bootstrap",
        "success_only_mean": 283562.75,
        "success_rate": 0.08163265306122448,
        "successes": 4,
        "wilson_high": 0.19189127596571287,
        "wilson_low": 0.032202817667763686
      },
      "parameters": {
        "min_eval": 20000,
        "num_energy_calcs": 800
      },
      "present_source": true,
      "provenance": {
        "code": "gasp",
        "code_version": "0.1",
        "commit": "0c8d993c82e0e1c69a05b3c34bbb2fcbbdbb7f07",
        "machine": {
          "machine": "x86_64",
          "node": "cursor",
          "python": "3.12.3",
          "system": "Linux"
        },
        "parameters": {
          "min_eval": 20000,
          "num_energy_calcs": 800
        }
      },
      "starts": [
        {
          "cap": 16000801,
          "comparable": true,
          "counter": "harness",
          "energy": -173.25237841565,
          "energy_calcs": 800,
          "failed_calcs": 0,
          "failure": "wrong_stationary",
          "force_calls": 277265,
          "reasons": [
            "energy"
          ],
          "schema": "optbench.start/v2",
          "seed": 20261015,
          "start": "0",
          "success": false,
          "verify_calls": 0
        },
        {
          "cap": 16000801,
          "comparable": true,
          "counter": "harness",
          "energy": -173.25237841565,
          "energy_calcs": 800,
          "failed_calcs": 0,
          "failure": "wrong_stationary",
          "force_calls": 281769,
          "reasons": [
            "energy"
          ],
          "schema": "optbench.start/v2",
          "seed": 20261016,
          "start": "1",
          "success": false,
          "verify_calls": 0
        },
        {
          "cap": 16000801,
          "comparable": true,
          "counter": "harness",
          "energy": -173.928426590629,
          "energy_calcs": 757,
          "failed_calcs": 0,
          "failure": null,
          "force_calls": 313263,
          "reasons": [],
          "schema": "optbench.start/v2",
          "seed": 20261017,
          "start": "2",
          "success": true,
          "verify_calls": 0
        },
        {
          "cap": 16000801,
          "comparable": true,
          "counter": "harness",
          "energy": -173.134317008843,
          "energy_calcs": 800,
          "failed_calcs": 0,
          "failure": "wrong_stationary",
          "force_calls": 362154,
          "reasons": [
            "energy"
          ],
          "schema": "optbench.start/v2",
          "seed": 20261018,
          "start": "3",
          "success": false,
          "verify_calls": 0
        },
        {
          "cap": 16000801,
          "comparable": true,
          "counter": "harness",
          "energy": -173.25237841565,
          "energy_calcs": 800,
          "failed_calcs": 0,
          "failure": "wrong_stationary",
          "force_calls": 267137,
          "reasons": [
            "energy"
          ],
          "schema": "optbench.start/v2",
          "seed": 20261019,
          "start": "4",
          "success": false,
          "verify_calls": 0
        },
        {
          "cap": 16000801,
          "comparable": true,
          "counter": "harness",
          "energy": -173.134317008843,
          "energy_calcs": 800,
          "failed_calcs": 0,
          "failure": "wrong_stationary",
          "force_calls": 346063,
          "reasons": [
            "energy"
          ],
          "schema": "optbench.start/v2",
          "seed": 20261020,
          "start": "5",
          "success": false,
          "verify_calls": 0
        },
        {
          "cap": 16000801,
          "comparable": true,
          "counter": "harness",
          "energy": -173.25237841565,
          "energy_calcs": 800,
          "failed_calcs": 0,
          "failure": "wrong_stationary",
          "force_calls": 318870,
          "reasons": [
            "energy"
          ],
          "schema": "optbench.start/v2",
          "seed": 20261021,
          "start": "6",
          "success": false,
          "verify_calls": 0
        },
        {
          "cap": 16000801,
          "comparable": true,
          "counter": "harness",
          "energy": -173.25237841565,
          "energy_calcs": 800,
          "failed_calcs": 0,
          "failure": "wrong_stationary",
          "force_calls": 352870,
          "reasons": [
            "energy"
          ],
          "schema": "optbench.start/v2",
          "seed": 20261022,
          "start": "7",
          "success": false,
          "verify_calls": 0
        },
        {
          "cap": 16000801,
          "comparable": true,
          "counter": "harness",
          "energy": -170.989860472813,
          "energy_calcs": 800,
          "failed_calcs": 0,
          "failure": "wrong_stationary",
          "force_calls": 411258,
          "reasons": [
            "energy"
          ],
          "schema": "optbench.start/v2",
          "seed": 20261023,
          "start": "8",
          "success": false,
          "verify_calls": 0
        },
        {
          "cap": 16000801,
          "comparable": true,
          "counter": "harness",
          "energy": -173.25237841565,
          "energy_calcs": 800,
          "failed_calcs": 0,
          "failure": "wrong_stationary",
          "force_calls": 330371,
          "reasons": [
            "energy"
          ],
          "schema": "optbench.start/v2",
          "seed": 20261024,
          "start": "9",
          "success": false,
          "verify_calls": 0
        },
        {
          "cap": 16000801,
          "comparable": true,
          "counter": "harness",
          "energy": -173.134317008843,
          "energy_calcs": 800,
          "failed_calcs": 0,
          "failure": "wrong_stationary",
          "force_calls": 356939,
          "reasons": [
            "energy"
          ],
          "schema": "optbench.start/v2",
          "seed": 20261025,
          "start": "10",
          "success": false,
          "verify_calls": 0
        },
        {
          "cap": 16000801,
          "comparable": true,
          "counter": "harness",
          "energy": -173.25237841565,
          "energy_calcs": 800,
          "failed_calcs": 0,
          "failure": "wrong_stationary",
          "force_calls": 311685,
          "reasons": [
            "energy"
          ],
          "schema": "optbench.start/v2",
          "seed": 20261026,
          "start": "11",
          "success": false,
          "verify_calls": 0
        },
        {
          "cap": 16000801,
          "comparable": true,
          "counter": "harness",
          "energy": -173.134317008843,
          "energy_calcs": 800,
          "failed_calcs": 0,
          "failure": "wrong_stationary",
          "force_calls": 318963,
          "reasons": [
            "energy"
          ],
          "schema": "optbench.start/v2",
          "seed": 20261027,
          "start": "12",
          "success": false,
          "verify_calls": 0
        },
        {
          "cap": 16000801,
          "comparable": true,
          "counter": "harness",
          "energy": -172.237562755683,
          "energy_calcs": 800,
          "failed_calcs": 0,
          "failure": "wrong_stationary",
          "force_calls": 329569,
          "reasons": [
            "energy"
          ],
          "schema": "optbench.start/v2",
          "seed": 20261028,
          "start": "13",
          "success": false,
          "verify_calls": 0
        },
        {
          "cap": 16000801,
          "comparable": true,
          "counter": "harness",
          "energy": -173.25237841565,
          "energy_calcs": 800,
          "failed_calcs": 0,
          "failure": "wrong_stationary",
          "force_calls": 361636,
          "reasons": [
            "energy"
          ],
          "schema": "optbench.start/v2",
          "seed": 20261029,
          "start": "14",
          "success": false,
          "verify_calls": 0
        },
        {
          "cap": 16000801,
          "comparable": true,
          "counter": "harness",
          "energy": -173.134317008843,
          "energy_calcs": 800,
          "failed_calcs": 0,
          "failure": "wrong_stationary",
          "force_calls": 367907,
          "reasons": [
            "energy"
          ],
          "schema": "optbench.start/v2",
          "seed": 20261030,
          "start": "15",
          "success": false,
          "verify_calls": 0
        },
        {
          "cap": 16000801,
          "comparable": true,
          "counter": "harness",
          "energy": -173.134317008843,
          "energy_calcs": 800,
          "failed_calcs": 0,
          "failure": "wrong_stationary",
          "force_calls": 400595,
          "reasons": [
            "energy"
          ],
          "schema": "optbench.start/v2",